,ID,Conversation.ID,Text,Movie.Title,Movie.ID,Release.Year,Genre,Formal/Informal
42711,42711,L196973,"Good day to you, sir., Move aside. This is the King's road, and the knights you joined arms against were his very own., I await the King himself. His knights are in need of training., I am King, and this is Excalibur, sword of kings from the dawn of time. Who are you, and why do you block the way?, I am Sir Lancelot of the Lake, from across the sea. I am the best knight in the whole of Christiandom, and I look for the king who is worthy of my sword's service., --That is a wild boast. You lack a knight's humility., Not a boast, sir, but a curse.  Never have I met my match in joust or duel., Move aside!, I will not. You must retreat or prove your kingship in the test of arms, under the eyes of God., ",excalibur,m340,1981,"['adventure', 'drama', 'fantasy']",formal
42957,42957,L198801,"Oh, brother., And it's especially nice to be among friends tonight, because, well, tonight's a very special night for my brother and I. This evening we've asked a young lady to join us, a lady Jack and I are sure will soon seem like just another old friend to you all.  She's making her debut here this evening and, as far as I'm concerned, she couldn't be doing it in a better place. Because there's one place that's always been for us a very special place, and that place is this place, the Ambassador Lounge.  Ladies and gentlemen, please welcome a very special lady with a very special way of singing a song, Miss Susie Diamond., ",the fabulous baker boys,m342,1989,"['drama', 'music', 'romance']",formal
43028,43028,L198785,"We need scissors over here! Who's got scissors?  Okay, remember.  Jack and I go on first, I do the set-up, then introduce you. And you say ..., Good evening, ladies and gentlemen. I can't tell you how thrilled I am to be here. It's like a dream come true. And speaking of dreams ..., Right., Piece of cake., ",the fabulous baker boys,m342,1989,"['drama', 'music', 'romance']",formal
43040,43040,L199083,"Good morning, gentlemen.  I'm Mr. Daniels, the manager.  I believe I've spoken to one of you on the phone., That'd be me, sir.  Frank Baker. This is my brother Jack., ",the fabulous baker boys,m342,1989,"['drama', 'music', 'romance']",formal
43425,43425,L204689,"What do you want, Vic?, To help you.  I've run every test known to man.  And they all yield the same result: <u>the machine is ready</u>., ",the fantastic four,m345,1994,"['action', 'adventure', 'sci-fi', 'fantasy']",formal
43881,43881,L213401,"What are you doing running through the streets in your underpants?  We both use that body., Since when is Project Mayhem about murder?, The buildings were evacuated thirty minutes ago.  Everything's proceeding exactly as planned., You don't know that.  There could still be people inside., ",fight club,m348,1999,"['crime', 'drama', 'mystery', 'thriller']",formal
44134,44134,L216167,"... to target at Ban Kia Na.  We probe the site..., Ninety., ... then proceed downriver to extraction at point Echo Delta. Doyle takes us out by helicopter, we all live happily ever after and that's the last time, Rambo!  I swear to Christ., One hundred., ",rambo: first blood part ii,m351,1985,"['action', 'adventure', 'thriller']",formal
44136,44136,L216162,"Again., Insertion.  Call in to base camp by TRANSAT.  Proceed to point Tango November for rendezvous with our ground contact.  Indigenous agent. Co Phuong Bao.  We've been over this three times., You stopped., ",rambo: first blood part ii,m351,1985,"['action', 'adventure', 'thriller']",formal
44157,44157,L216086,"Memo E-7 on top will cover the details.  An abandoned Vietnamese Army base in the North-central highlands may have a compound used as an internment camp.  As you can see the intelligence is soft.  These LANDSAT photos show huts... barracks.  It could be anything., What's the plan?, This operation is in two phases. Recon and rescue.  You are phase one.  Your two-man team will probe the site, confirm the presence of American POWs, if any, make photographic and tactical observations, then proceed to the extraction point without engaging the enemy., We don't try to pull out any of our guys if we find them?, Negative.  Absolutely not.  The phase two assault team will get them out., We just take pictures?, Don't look so disappointed.  It should be hairy enough... even for you., ",rambo: first blood part ii,m351,1985,"['action', 'adventure', 'thriller']",formal
44296,44296,L217561,"Come on! Go for it! What the hell are they gonna do? They can't do nothin!, <u>Nothing!</u> <u>They</u> <u>can</u> <u>do</u> <u>nothing!</u> <u>Gentlemen!</u>, ",the fisher king,m352,1991,"['comedy', 'drama', 'romance']",formal
44517,44517,L219552,"Refusal to pay alimony is a jailable offense, Fletch., What about breaking and entering?  Are you wearing anything under that?, I did not break nor enter. I simply chose an advisable location to await my client's delinquent husband., I hate to conduct business on the lanai. Why don't we step inside., ",fletch,m355,1985,"['comedy', 'crime', 'mystery']",formal
45211,45211,L230595,"See, Daddy., And Peter Redmond helped immensely. These pauses were exquisitely timed. He made us wait and wait. He built a gorgeous tension and suspense., ",game 6,m363,2005,"['comedy', 'drama', 'sport']",formal
45281,45281,L230678,"Just like proper English gentlemen. I'm proud of them., They are boys. -- And they're Indian., ",gandhi,m364,1982,"['biography', 'drama', 'history']",formal
46281,46281,L248332,"Anyone? The significance of ""Robin 1"" on Magnum's license plate? Memphis?, Robin was Robin Masters. He owned the estate they lived on ..., Ten points for our fearless leader ... Sway, how 'bout giving us the honor of the Bill Bixby trifecta -- ?, ",gone in sixty seconds,m371,2000,"['action', 'crime', 'thriller']",formal
46284,46284,L248089,"Some crew you got ..., If we put out the word. That we're crewing-up, for a one-time-only job... What do you think that'll yield?, ",gone in sixty seconds,m371,2000,"['action', 'crime', 'thriller']",formal
47004,47004,L259400,"Due to Mr. Gill's untimely demise and everything, I guess you two will have to improvise the next round., Right. If I win, you wear a dress on our date., ",hackers,m377,1995,"['action', 'crime', 'drama', 'thriller']",formal
47072,47072,L259028,"Alright. How about the Master of Disaster, huh?, You're hopeless, man, utterly hopeless., ",hackers,m377,1995,"['action', 'crime', 'drama', 'thriller']",formal
47087,47087,L259203,"Good morning, Gentlemen. Please be seated. I see we're still dressing in the dark, Eugene., Once again, don't call me Eugene.  A recent unknown intruder penetrated, using a superuser acount, giving him access to our whole system., Precisely what you're paid to prevent., Someone didn't bother reading my carefully prepared memo on commonly used passwords. Now, as I so meticulously pointed out, the for most used passwords are love,  sex, secret and...  ...God. So would your holiness care to change her password?, ",hackers,m377,1995,"['action', 'crime', 'drama', 'thriller']",formal
47533,47533,L265057,"I think that's... {HE STARTS TO RISE, AND THE MEETING BEGINS TO BREAK UP) Starling, I'm sure these gentlemen..., And how did she get close enough to disarm you?, ",hannibal,m381,2001,"['crime', 'thriller']",formal
47566,47566,L265029,"And you let her get away., Sir, with all due respect...., ",hannibal,m381,2001,"['crime', 'thriller']",formal
47766,47766,L271584,"Ram and I died the day we realized we could never reveal our forbidden love to an uncaring and ununderstanding world. The joy we shared in each other's arms was greater than any touchdown. Yet we were forced to live the lie of Sexist- Beer Guzzling-Jock-Asshole., Exquisite, but I don't think ununderstanding is a word., We don't want to make them out to be too secretly eloquent. Why would the Germans invent a bullet that doesn't kill people? I mean it <u>was</u> World War Two, not a school play., They used them on themselves to make it look like they were dead. Really quite a brilliant device, but too flamboyant to seriously produce., Neat. Let's try it out on J.F.K., ",heathers,m383,1989,"['comedy', 'crime']",formal
47942,47942,L276349,"It was an analogy. Your soul is locked up inside you. You need to free it Trevor. You've blocked it from the healing process. That's what we need to do now. Heal your soul. And to do that I you have to give in utterly and without any hesitation or doubt. Do you know what I mean by giving in? It's about trust. Do you trust me implicitly?, I don't even know what's real and what isn't how can I trust anyone?, You can trust me. Your wife is dead and you need to move past that. And the only way to move past something completely is to go straight through it, not around it. Surrender yourself to your wife's death. Let it chew you up and spit you back out on the other side. It's the only way you can become whole again., ",hellraiser: hellseeker,m385,2002,"['horror', 'mystery', 'thriller']",formal
48412,48412,L288792,"Do we know who fired the missile that killed the president?, No. But I fear it's intention may have been to kill the peace accords and spark a civil war between the Hutu Militia and the Tutsi rebels., We've heard reports of reprisal killings. Will the UN intervene to stop the bloodshed.?, Unfortunately we're here as peace-keepers not peace makers, we can't take an aggressive role., If the UN changes your mandate could you stop the bloodshed?, Yes. With some re-inforcements I'm confident we could impose order., Have you requested re-enforcements?, Yes we have., What was the response?, We're awaiting a decision, excuse me., ",hotel rwanda,m390,2004,"['adventure', 'drama', 'history', 'thriller', 'war']",formal
48437,48437,L288434,"Paul, this scotch is exceptional., It's a single malt, Glenmorangie. I thought you'd like it. Anything you need, gentlemen, let me know., Oh, Paul, talk to the coat check, please., ",hotel rwanda,m390,2004,"['adventure', 'drama', 'history', 'thriller', 'war']",formal
48623,48623,L290952,"I don't know, Ms. Jenzen., Well, who's the damn thing <u>from</u>?, Messenger just dropped it off. No return address., You didn't think to ask?, I was in the middle of --, -- being utterly fucking useless, what else is new., ",house on haunted hill,m391,1999,"['horror', 'mystery', 'thriller']",formal
49033,49033,L293970,"...Congratulations, kid, you've really outdone yourself. Reinvented the wheel. I'm going to recommend to the Board that we proceed immediately with this, uh... with the, uh... that the dingus be mass-produced with all deliberate speed. Of course, as president of the company the ultimate decision is yours., Well... I'm for it..., ",the hudsucker proxy,m395,1994,"['comedy', 'drama', 'fantasy', 'romance']",formal
49376,49376,L305818,"In Europe, Louis. We shall meet our own kind. Find the one who made him. Learn what it means., And suppose the one who made him knows nothing and the vampire who made him knows nothing, and it goes back, nothing proceeding from nothing, until there is nothing! And we must live with the knowledge that there is no knowledge., ",interview with the vampire: the vampire chronicles,m399,1994,"['drama', 'fantasy']",formal
49554,49554,L308420,"Come on, it'll be fun., Ladies and gentlemen, please put your hands together for my friend, my very best friend, Julie James., ",i still know what you did last summer,m400,1998,"['horror', 'mystery', 'thriller']",formal
49588,49588,L308796,"I took it for granted you gentlemen were refugees as are my other guests., This is General Nikolas Pherides, Commander of the Third Army. I'm Oliver Davis.  To be perfectly frank with you, we didn't expect to find anyone living here., It is my home.  My name is Hugo Albrecht., ",isle of the dead,m401,1945,"['drama', 'horror', 'mystery', 'thriller']",formal
49613,49613,L308861,"I hope Mr. Jacks gets to bed in one piece., M~ father will take care of it.  Pappa is wonderful! No matter what happens, he makes me feel perfectly safe.  I could never leave him. I should be utterly helpless by myself., ",isle of the dead,m401,1945,"['drama', 'horror', 'mystery', 'thriller']",formal
50287,50287,L324454,"How many...?, Will you leave me alone...?, You tagging them...?, I'm separating the ladies from the gentlemen...., You moved any slower, you'd grow roots...We've got a schedule...shake it, man...., The females have eggs...., We'll pass around cigars...., ",jaws: the revenge,m405,1987,['thriller'],formal
50369,50369,L325739,"Alright, gentlemen, I'm gonna leave you. I got a couple of questions for the paper, Serg- eant? Mind if I swing by later, wring out a tea-bag with you?, My pleasure .. Who's Popeye?, Your predecessor. He did- n't like to get outta bed. Catch you later, Freddy T .., ",jennifer eight,m407,1992,"['thriller', 'mystery']",formal
50693,50693,L330181,"What?, Well?  Didn't it all seem a trifle compact to you?, What are you talking about?, The hatchery, in particular?  You know my initial yields had to be low, far less than one percent, that's a thousand embryos for every single live birth.  Genetic engineering on that scale implies a giant operation, not the spotless little laboratory I showed you., I don't believe you., Isla Nublar was just a showroom, Ian, something for the tourists, Site B was the factory floor.  We built it first, on Isla Sorna, eight-some miles from Nublar., No, no, no, no, no, no . . ., After the accident at the park, a hurricane wiped out our facility on Site B.  We had to evacuate and leave the animals to fend for themselves. And they did.  For four years I've fought to keep them safe from human meddling, now I want you to go there and document them., Are you out of your mind?  I still have nightmares, my reputation's a joke, my leg is shot -- you think I need more of that?, It would be the most extraordinary living fossil record the world has ever seen., So what?, ",the lost world: jurassic park,m410,1997,"['action', 'adventure', 'sci-fi', 'thriller', 'action', 'adventure', 'animation', 'horror', 'sci-fi', 'thriller']",formal
50735,50735,L330666,"You gentlemen feel you have to do this now?, Now's the perfect time.  The animal just fed, so it won't stalk us for food.  Predators don't hurt when they're not hungry., ",the lost world: jurassic park,m410,1997,"['action', 'adventure', 'sci-fi', 'thriller', 'action', 'adventure', 'animation', 'horror', 'sci-fi', 'thriller']",formal
50737,50737,L330574,"Somewhere on this island, there exits the greatest predator that ever lived.  And the second greatest predator must take him down., But why?, You remember that guy, about twenty years ago, I forget his name, but he climbed Everest without any oxygen, came down almost dead.  And they asked him, ""why did you go up there to die?""  And he said ""I didn't.  I went up there to live."", It's called self-testing.  But in your case, it sounds more like self-destruction.  A uniquely human characteristic.  In fact, human beings destroy things so well that I sometimes think that's our function. Maybe every few sons, some animal comes along that kills off the rest of the world, clears the decks, and lets evolution proceed to his next phase.  Maybe death and destruction are our job, maybe we're supposed to destroy ourselves and every other living thing that-, ",the lost world: jurassic park,m410,1997,"['action', 'adventure', 'sci-fi', 'thriller', 'action', 'adventure', 'animation', 'horror', 'sci-fi', 'thriller']",formal
50769,50769,L331916,"Ladies and gentlemen, last shuttle to the dock leaves in approximately five minutes.  Drop what you are doing and leave now., Damn!, ",jurassic park,m411,1993,"['action', 'adventure', 'family', 'sci-fi', 'action', 'adventure', 'fantasy', 'sci-fi']",formal
50844,50844,L331797,"Have a heart gentlemen.  Their parents are getting a divorce and they need the diversion., Hey!  Where are the brakes?, Brakes?  No.  No brakes.  They're electric cars, guided by this track in the roadway, and totally non-polluting, top of the line!, ",jurassic park,m411,1993,"['action', 'adventure', 'family', 'sci-fi', 'action', 'adventure', 'fantasy', 'sci-fi']",formal
51086,51086,L335464,"Am actually laying my hand on the twenty-five foot gorilla.Ladies and gentlemen! I am touching the beast!, Take your filthy paws off him -you ignorant pig!, ",king kong,m414,2005,"['adventure', 'drama', 'romance']",formal
51231,51231,L337502,"Ladies and gentlemen..., Ladies and gentlemen..., Welcome to the greatest show on earth., Welcome to the..., ",kramer vs. kramer,m416,1979,['drama'],formal
51272,51272,L338052,"Objection!  Your honor, counsel is raising a question that is not germane to these proceedings., While the child was in the care of the witness, he cut his face badly and is now scarred., ",kramer vs. kramer,m416,1979,['drama'],formal
51575,51575,L340204,"Oh.  Oh.  That's okay.  Well.  This uh... this probably wasn't meant to be, y'know.  I mean, I'm... God, I gotta be ten years younger and you, <u>you</u>... you're y'know..., A jerk., <u>Oh</u>...  No, no, I'm not angry I'm not, I'm just thrown, I'm...  I actually have an early lunch, so..., It's ten after nine., Yes, well...  famished., ",lake placid,m418,1999,"['action', 'comedy', 'horror', 'thriller']",formal
51657,51657,L341999,"He was a town marshal... one night he surprised two burglars, coming out the back of a drugstore... They shot him., Killed outright?, No. He was strong, he lasted almost a month. My mother - died when I was very young, so my father had become - the whole world to me... After he left me, I had nobody. I was ten years old., You're very frank, Clarice. I think - it would be quite something to know you in private life., Quid pro quo, Doctor., The significance of the moth is change. Caterpillar into cocoon into beauty... Billy wants to change, too, Clarice. But there's the problem of his size, you see. Even if he were a woman, he'd have to be a big one..., Dr. Lecter, there's no correlation in the literature between transsexualism and violence. Transsexuals are very passive., Clever girl. You're so close to the way you're going to catch him - do you realize that?, No. Tell me why., After your father's death, you were orphaned. What happened next?  I don't imagine the answer's on those second-rate shoes, Clarice., I went to live with my mother's cousin and her husband in Montana. They had a ranch., A cattle ranch?, Horses - and sheep..., How long did you live there?, Two months., Why so briefly?, I - ran away..., Why, Clarice? Did the rancher fuck you?, No., Did he try to?, No...! Quid pro quo, Doctor., Billy's not a real transsexual, but he thinks he is. He tries to be. He's tried to be a lot of things, I expect., You said - I was very close to the way we'd catch him., There are three major centers for transsexual surgery: Johns Hopkins, the University of Minnesota, and Columbus Medical center. I wouldn't be surprised if Billy has applied for sex reassignment at one or all of them, and been rejected., On what basis would they reject him?, The personality inventories would trip him up. Rorschach, Wechsler, House-Tree-Person... He wouldn't test like a real transsexual., How would he test?, ",the silence of the lambs,m419,1991,"['crime', 'thriller']",formal
51755,51755,L342506,"We must... stop... soon. Women are... tired.  You... understand?, I understand. This is not good place to stop.  Two leagues from here. No water 'til then.  That where we stop. Better place., No. Stop in the glade just ahead! When the ladies are rested, we will proceed. Do you understand?, ""Magua understand paleface is a dog to his women.  When his women want to eat, he lay aside his tomahawk to feed their laziness."", Excuse me. What did you say?, Magua say: ""Yes. Good idea."", ",last of the mohicans,m420,1977,"['action', 'adventure', 'war']",formal
51894,51894,L351941,"Let me tell you about Hatchet Harry. Once there was this geezer called Smithy Robinson who worked for Harry. It was rumoured that he was on the take. Harry invited Smithy round for an explanation. Smithy didn't do a very good job. Within a minute Harry lost his temper and reached for the nearest thing at hand, which happened to be a fifteen-inch black rubber cock. He then proceeded to batter poor Smithy to death with this; that was seen as a pleasant way to go . . . Hence, Hatchet Harry is a man you pay if you owe., I'll think of something, don't worry., ","lock, stock and two smoking barrels",m422,1998,"['crime', 'thriller']",formal
52062,52062,L353870,"I sprint the last quarter mile. You gentlemen don't have to keep up if you don't care to., Appreciate it, sir., ",lone star,m423,1996,"['drama', 'mystery', 'romance', 'western']",formal
52253,52253,L355188,"I only wear ties for funerals., You don't get in without one. It's like a gentlemen's club for illusionists.  Except most of us aren't gentlemen., ",lord of illusions,m424,1995,"['fantasy', 'horror', 'mystery', 'thriller']",formal
52822,52822,L367092,"Please revel with me, Aramis, I need my spirits lifted.  I'm old, I'm weak, my strength is gone --, Be quiet, you fat fool.  Can't you see I'm praying?, I just said you're praying!  Are you deaf too?  I know you're blind, because if you had seen the tits that just walked out of here, you'd have tears in your eyes., There are more important things than tits., Really?  If you can name me one thing, one single thing, that is more sublime than the feel of a plump pink nipple between my lips, I will buy you a new cathedral., ",the man in the iron mask,m429,1998/I,"['action', 'adventure', 'drama', 'history']",formal
53163,53163,L370181,"I was very original!, Yeah, exactly -- ""was""!  But now, you're creatively bankrupt.  In fact, Ladies and Gentlemen, Kaufman's so desperate, he PAID me to do this tonight!!  I'm a plant. It's just a fresh coat of paint on an old broken-down routine.  Isn't that true???, ",man on the moon,m432,1999,"['biography', 'comedy', 'drama']",formal
53490,53490,L376380,"What do you think the Board is going to say when I tell them that?, I don't care., With all due respect, you damn well better care because if you try to stonewall them again, there'll be blood on the floor., ",meet joe black,m435,1998,"['drama', 'fantasy', 'mystery', 'romance']",formal
54700,54700,L396648,"No doubt you've heard the rumors., I take no account of gossip, Your Highness., My concern is for the reputation of the Monarchy., Of course., I fear the influence he has on her. The man's word is not to be credited. He is an arriviste of the very lowest water.  She's having a bust cast of him.  In Nero Marquino marble., I see., I would talk to her myself, but she won't listen to me.  She must be persuaded, by someone she respects, to abandon this ridiculous favoritism before a situation develops., A situation?, I don't imagine you frequent the Republican Clubs.  But the fact that neither you nor I are members should not blind us to the significance of their existence.  The Tory Party has always been our party., I'm flattered you think so., I tell you, if we don't stick together on this, you could find yourself First President's Opposition.  Du Royaum Uni., Quite., ",mrs brown,m446,1997,"['biography', 'drama', 'history', 'romance']",formal
54706,54706,L396596,"Surely it is for the gentlemen to decide when to stop..., It is a disgusting habit, Bertie.  It should be discouraged., Yes, but isn't midnight a little excessive?, It is quite late enough., But mama, the room was built expressly for that purpose.  It has been a smoking-room by tradition ever since father --, Brown's responsibilities are onerous enough already.  He has far too much to do without having to stay up all night waiting for you to go to bed. The smoking-room will be closed and the lights put out at twelve o'clock., Mama..., And that is my last word on the matter., Well, I'm sorry, but I really do think it's too much that the gentlemen of the house should be dictated to by a servant., ",mrs brown,m446,1997,"['biography', 'drama', 'history', 'romance']",formal
54719,54719,L396468,"Awaiting my orders., You do not report for duty unless the Queen requests it.  You know that very well., I didn't come all this way to sit on my arse., You will await your orders like everyone else.  Unless you prefer a repeat of yesterday's little excitement., No., I beg your pardon?, ",mrs brown,m446,1997,"['biography', 'drama', 'history', 'romance']",formal
54755,54755,L396721,"Forgive me, gentlemen.  I'm late., Not at all, Dean.  Good of you to spare the time., I came as quickly as I could., You've seen the latest cartoon in Punch, I take it?, I beg your pardon?, ",mrs brown,m446,1997,"['biography', 'drama', 'history', 'romance']",formal
54948,54948,L401689,"And now ladies and gentlemen it's time for the fabulous CROCODILE SHOW !, Great ! You couldn't be a fan of Dolphins or some other less threatening animal., ","""murderland""",m449,2009,"['crime', 'drama', 'mystery']",formal
55060,55060,L401422,"Just look at this tie. You could fry an egg off that orange, yow. Have you ever considered the Jerry Garcia line of ties ?, Excuse me, gentlemen, ","""murderland""",m449,2009,"['crime', 'drama', 'mystery']",formal
56501,56501,L428174,"Don't you have any clubs?, No!, Let me see your hand!, No!, Well, if you gentlemen will excuse me, I have some pressing matters to attend to., ",one flew over the cuckoo's nest,m463,1975,['drama'],formal
56503,56503,L428256,"Miss Ratched. Given all the conditions of that sublime relationship, coupled with the subsequent annihilation of all that I held to be sacred, mentally, physically and emotionally, the only thing that I can speculate on, at this late date, is how I will justify the very existence of my life, with or without my dear wife., What's he talkin' about?, ",one flew over the cuckoo's nest,m463,1975,['drama'],formal
