,ID,Conversation.ID,Text,Movie.Title,Movie.ID,Release.Year,Genre,Formal/Informal
35505,35505,L108562,"Look, I'm just on this boat, okay? I'm an engineer.  Whatever this is, it's not for me to be involved, okay?, I don't remember Zurich., ",the bourne identity,m282,2002,"['action', 'adventure', 'mystery', 'thriller']",formal
11064,11064,L283645,"Are you sure Williams is not all there?, All you've got to do is talk to him. But the Mayor would hang his own grandmother to be re-elected., But couldn't you show the man wasn't responsible?, How?, ",his girl friday,m90,1940,"['comedy', 'drama', 'romance']",formal
37117,37117,L126252,"Go on, please -- five men -- $250,000 -- the French Underground --, Yes. The five men. They were, of course, your husband, Charles, the three men who showed up at his funeral yesterday, and Carson Dyle. But something went wrong and they were unable to locate their contact. It must have been at that point that they decided to steal the money., Steal it how?, By burying it, and then reporting that the Germans had captured it. All they had to do was come back after the war, dig it up and split it five ways -- a quarter of a million dollars with no questions asked., May I have a cigarette, please?, ",charade,m293,1963,"['comedy', 'mystery', 'romance', 'thriller']",formal
38580,38580,L142880,"Page after page of data -- over sixty-three thousand in all, if I'm not mistaken... and at the end of each..., A page-break signal.  A period., Not if you think like a Vegan., You're saying... there is no separate primer in the message -- because it's on every page so the recipient can decipher it wherever he is --, -- even if he doesn't receive the entire transmission.  Heaven is the mustard seed., ",contact,m304,1997,"['drama', 'mystery', 'sci-fi', 'thriller']",formal
72666,72666,L648549,"Does Norman know?, Jody, she's alive., What?, Mrs. Feur.  She's alive.  I met her. She's really sweet., Then what was it?, Nothing.  It wasn't anything.  I've been on edge lately.  Maybe since the accident. And I'd prefer, I really would, to just--, Something was there.  You saw it., Did I?, Yes.  Now I talked to Sela and there's a guy, this Pakistani guy down in Hartford..., Hartford?, And he's the real thing.  Specializes in cases like this, like yours., No.  Jody, listen to me.  You have to listen to me.  This is not something that I can do right now.  Whatever it was, it's gone.  I need it to be gone now., But Claire--, Please., ",what lies beneath,m601,2000,"['drama', 'horror', 'mystery', 'thriller']",formal
3177,3177,L62922,"I strongly feel that a Negro should direct this.  This kind of satire is a high wire act in a gale storm. One misstep and we're doing ""Amos and Andy.""  Only a Negro will have the sensitivity and cultural awareness to navigate this dangerous terrain., To hire someone solely on their ethnicity, gender or religion is not right.  It's un-American.  I will hire someone who is most qualified for this particular job., ",bamboozled,m27,2000,"['comedy', 'drama', 'music']",formal
31810,31810,L51390,"How do you write women so well?, I think of a man and take away reason and accountability., ",as good as it gets,m249,1997,"['comedy', 'drama', 'romance']",formal
4077,4077,L87852,"You become pregnant by a man who runs off with your best friend, and you decide to get an abortion., I'd never get an abortion., Why not?, That would be murder, Mr. Deckard., In your opinion., It would be my child., Sounds like you speaks from experience., ",blade runner,m34,1982,"['drama', 'sci-fi', 'thriller']",formal
15078,15078,L349601,"Adam, that's not true!, Yes, it is., Would you stop being ridiculous?  Your father wants Sam home as much as I do., ",life as a house,m119,2001,"['drama', 'romance']",formal
15752,15752,L356937,"It would serve you right if you were left behind., How could I know that a war was going to break out right over my head!  Right over my head. Oh, my word! I tell you, those Chinese were pouncing on me from every direction. I had to get into these ridiculous clothes in order to escape., ",lost horizon,m124,1937,"['adventure', 'drama', 'fantasy', 'mystery']",formal
32319,32319,L61249,"Let me put it on a level you can understand. You don't belong here. You don't know anything about this world. You don't know the customs, you don't know how to talk, how to act -- you don't even look like you belong here. And if you walked out on the street, you wouldn't get 100 yards without being arrested. Then there would be questions, and where would we come up with the answers?, Okay, Professor, I get where you're coming from. The way I look, the way I'm dressed...  I'd stick out like a sore thumb., ",back to the future,m253,1985,"['adventure', 'family', 'sci-fi']",formal
39392,39392,L150256,"I just came to say goodbye., Where are you going?, Back to the city. I may take off to Europe for the rest of the summer. I just can't handle it around here., I think that's for the best., Good for you., Sebastian, please. I don't want us to end on bad terms., Well, I'm afraid you don't have a choice in the matter. You make me sick. You're a hypocrite and I don't associate with hypocrites., ",cruel intentions,m312,1999,"['drama', 'romance', 'thriller']",formal
39517,39517,L150049,"Got me off the streets? I live on 59th and Park., Whatever. You are never to set foot in this house again and you are never and I mean never to see my daughter again. Is that understood?!, ",cruel intentions,m312,1999,"['drama', 'romance', 'thriller']",formal
71862,71862,L640501,"It's really a stupid opinion. You have developed an annoying habit of talking for what seems to be no other reason than to hear yourself speak., Because my opinion threatens yours, it's poorly developed?, No, because your opinions are idiotic and have nothing to do with what any given conversation is about, which makes 85% of your eagerly injected thought process highly offensive to me., Boyd brought up divorce statistics., ",very bad things,m595,1998,"['comedy', 'crime', 'thriller']",formal
1748,1748,L30270,"It is new, it is, isn't it, Sire?, Yes, indeed., And German?, Oh, yes. Absolutely. German. Unquestionably!, So then you like it? You really like it, Your Majesty?, Of course I do. It's very good. Of course now and then - just now and then - it gets a touch elaborate., What do you mean, Sire?, Well, I mean occasionally it seems to have, how shall one say?  How shall one say, Director?, ",amadeus,m16,1984,"['biography', 'drama', 'music']",formal
2223,2223,L35751,"She's still talking to Jesus., What worries me is that Jesus is talking back., ",american outlaws,m19,2001,"['action', 'western']",formal
767,767,L5404,"A weapon against evil.  Amazing!  I am going to be famous., Then let us toast to your fame!  Here Billy.., ",the fifth element,m5,1997,"['action', 'adventure', 'romance', 'sci-fi', 'thriller']",formal
1727,1727,L30510,"I don't think you understand me, Court Composer., Majesty, I did. Believe me, it was a most agonizing. decision. But finally, I simply could not recommend Herr Mozart., Why not?, Well, Sire, I made some inquiries in a routine way. I was curious to know why he had so few pupils. It is rather alarming., Oh?, ",amadeus,m16,1984,"['biography', 'drama', 'music']",formal
1728,1728,L30369,"An interesting idea, Majesty. But -, Yes?, You already commissioned an opera from Mozart., And the result satisfies., Yes, of course. My concern is to protect you from any suspicion of favouritism., Ah-ha. Favouritism. But I so want Mozart., I'm sure there is a way, Majesty. Some kind of a little contest. I could perhaps put together a small Committee, and I could see to it naturally that it will select according to Your Majesty's wishes., You please me, Court Composer. A very clever idea., Sire., Well. There it is., ",amadeus,m16,1984,"['biography', 'drama', 'music']",formal
1731,1731,L30202,"Well, I'm glad to hear that., Excuse me, Sire, but what do you think these could be? Being a foreigner, I would love to learn., Cattivo again, Court Composer. Well, tell him, Mozart. Name us a German virtue., ",amadeus,m16,1984,"['biography', 'drama', 'music']",formal
1734,1734,L30152,"Delightful, Court Composer. Would you permit me to play it as he comes in?, You do me too much honour, Sire., Let's have some fun.  Bring in Herr Mozart, please. But slowly, slowly. I need a minute to practice., ",amadeus,m16,1984,"['biography', 'drama', 'music']",formal
1737,1737,L30831,"Forgive me, Majesty. I'm a vulgar man. But I assure you, my music is not., You are passionate, Mozart! But you do not persuade., Sire, the whole opera is finished. Do you know how much work went into it?, ",amadeus,m16,1984,"['biography', 'drama', 'music']",formal
1738,1738,L30815,"But, Majesty, this is just a frolic. It's a piece about love., Ah, love again., But it's new, it's entirely new. It's so new, people will go mad for it. For example, I have a scene in the second act - it starts as a duet, just a man and wife quarreling. Suddenly the wife's scheming little maid comes in unexpectedly - a very funny situation. Duet turns into trio. Then the husband's equally screaming valet comes in. Trio turns into quartet. Then a stupid old gardener - quartet becomes quintet, and so on.  On and on, sextet, septet, octet! How long do you think I can sustain that?, I have no idea., Guess! Guess, Majesty. Imagine the longest time such a thing could last, then double it., Well, six or seven minutes! maybe eight!, Twenty, sire! How about twenty? Twenty minutes of continuous music. No recitatives., ",amadeus,m16,1984,"['biography', 'drama', 'music']",formal
1739,1739,L30812,"Mozart, I am a tolerant man. I do not censor things lightly. When I do, I have good reason. Figaro is a bad play. It stirs up hatred between the classes. In France it has caused nothing but bitterness. My own dear sister Antoinette writes me that she is beginning to be frightened of her own people. I do not wish to see the same fears starting here., Sire, I swear to Your Majesty, there's nothing like that in the story. I have taken out everything that could give offense. I hate politics., I think you are rather innocent, my friend. In these dangerous times I cannot afford to provoke our nobles or our people simply over a theatre piece., ",amadeus,m16,1984,"['biography', 'drama', 'music']",formal
1740,1740,L30802,"Mozart, are you aware I have declared the French play of Figaro unsuitable for our theatre?, Yes, Sire., Yet we hear you are making an opera from it. Is this true?, Who told you this, Majesty?, It is not your place to ask questions. Is it true?, Well, yes, I admit it is., Would you tell me why?, Well, Majesty, it is only a comedy., ",amadeus,m16,1984,"['biography', 'drama', 'music']",formal
1742,1742,L30761,"Bravo, Mozart. Most charming. Yes, indeed. Clever man., Thank you, Sire!, ",amadeus,m16,1984,"['biography', 'drama', 'music']",formal
1749,1749,L30211,"Keep it, Sire, if you want to. It is already here in my head., What? On one hearing only?, I think so, Sire, yes., ",amadeus,m16,1984,"['biography', 'drama', 'music']",formal
1826,1826,L30205,"Love, Sire!, Ah, love! Well of course in Italy we know nothing about that., ",amadeus,m16,1984,"['biography', 'drama', 'music']",formal
1838,1838,L30822,"Mozart -, Sire, only opera can do this. In a play, if more than one person speaks at the same time, it's just noise. No one can understand a word. But with music, with music you can have twenty individuals all talking at once, and it's not noise - it's a perfect harmony. Isn't that marvelous?, Mozart, music is not the issue here. No one doubts your talent. It is your judgment of literature that's in question. Even with the politics taken out, this thing would still remain a vulgar farce. Why waste your spirit on such rubbish?  Surely you can choose more elevated themes?, Elevated? What does that mean? Elevated! The only thing a man should elevate is - oh, excuse me. I'm sorry. I'm stupid. But I am fed up to the teeth with elevated things! Old dead legends! How can we go on forever writing about gods and legends?, Because they do. They go on forever - at least what they represent. The eternal in us, not the ephemeral. Opera is here to ennoble us. You and me, just as much as His Majesty., ",amadeus,m16,1984,"['biography', 'drama', 'music']",formal
1856,1856,L30182,"Well, actually, Sire, if you remember, we did finally incline to Italian., Did we?, ",amadeus,m16,1984,"['biography', 'drama', 'music']",formal
1882,1882,L32083,"I am going to the cops. There's a full moon tonight. Jack was right. I..., Jack is dead!, Jack is dead. Look, six people have been killed. I'm going to the police., ",an american werewolf in london,m17,1981,"['horror', 'romance']",formal
1897,1897,L31723,"How old are you?, That's not really a very proper question., How old are you?, Twenty-eight., I'm twenty-seven., I know., Now what do you want to talk about?, Was Jack Goodman your good friend?, My best friend. My very best friend., Shall I read to you?, What? Oh, yes, please., A Connecticut Yankee in King Arthur's Court by Samuel L. Clemens. This is after the preface but before chapter one: A Word of Explanation. You all right?, Yes, go on., Ahem, A Word of Explanation. It was in Warwick Castle that I came across the curious stranger whom I am going to talk about. He attracted me by three things: his candid simplicity, his marvelous familiarity with ancient armor, and the restfulness of his company - for he did all the talking. We fell together as modest people will in the tail of the herd..., ",an american werewolf in london,m17,1981,"['horror', 'romance']",formal
4934,4934,L110286,"No. I have it to ease the suffering of the children of this war., This is what happens when you must send a woman. And a fool., Forgive me, Sire. I thought that generosity might demonstrate your greatness to those you mean to rule., My greatness is better demonstrated with this., ",braveheart,m40,1995,"['action', 'biography', 'drama', 'history', 'war']",formal
5118,5118,L119264,"Now you finish locking up, will you, Carl?, I will. Then I am going to the meeting of the --, -- Don't tell me where you're going., I won't., Goodnight., Goodnight, Monsieur Rick., ",casablanca,m42,1942,"['drama', 'romance', 'war']",formal
6160,6160,L163226,"I was insulted, so I asked her if I was wreaking some wicked b.o., right? Then she said no, she wanted to take a bath with me., Oh, this is terrible... Please go on., Well, she was a very tempting siren, Father. Built like you wouldn't believe. So I gave into temptation about a block away from the wedding reception at this little motel that charges by the hour., ",detroit rock city,m49,1999,"['comedy', 'music']",formal
6430,6430,L172394,"I -- I may be wrong, but I suspect the Secretary of War., Don't bother me - I'm thinking -- What was that?, I said - I suspect the Secretary of War., THIS IS TREASON!!  What a fool I was to listen to your siren song and fall a helpless victim under the insidious spell of your irresistible charms --, But -, You satisfied your selfish whims, while nations tottered, dynasties rocked and the world plunged headlong into a chasm of chaos and oblivion --  Not bad, eh?, ",duck soup,m52,1933,"['comedy', 'musical']",formal
7764,7764,L221713,"I'm sorry. She misunderstood, that's all., But you tell me you had a pleasant visit and your mother says you were sullen and uncommunicative. Whom do you think I should believe?, Doctor, I hate to break this to you, but my mother is a little batty., Frances, you're still filled with anxiety. You feel guilty and hostile toward your family and friends. Consequently, I didn't recommend your release at the staff review., You what?, Mental illness is an elusive thing, and though I'm pleased you're feeling more... capable, it's perhaps unrealistic to expect you to be completely cured after so short a time. Don't you agree?, ",frances,m62,1982,"['biography', 'drama']",formal
9623,9623,L251725,"Mr. McCleery -- do you have some change? I need to use the phone?, I want you out of here., Look -- I'll give you ten dollars for a dime -- I'll give you twenty -- for God's sake, will you let me use that phone?, I am going to call the police now., Could I make one phone call first?, Get out!, ",the graduate,m77,1967,"['comedy', 'drama', 'romance']",formal
10200,10200,L267845,"Honeymoon!  Honeymoon!  Say it: Honeymoon!, It's so--so stark., You used to like it stark!, Just--bang--we have a honeymoon., I'm not going to strike you.  I am going to be as gentle as pie--as lemon meringue pie.  You mustn't run away now.  This is your loving husband approaching.  I'm your husband.  Society approves!, ","happy birthday, wanda june",m82,1971,"['comedy', 'drama']",formal
13056,13056,L327852,"When are you going back to Washington, sir?, I am going back very shortly after we finish this hearing - I am going to have some lunch., Can I make a statement?  If you request me to go back to Washington with you right now, that is if you want to hear further testimony from me, can you do that?  Can you take me with you?, No, that could not be done, Mr. Ruby. There are a good many things involved in that., What are they?, Well, the public attention it would attract.  And we have no place for you there to be safe, we're not law enforcement officials, and many things are at stake in this affair, Mr. Ruby., But if I am eliminated there won't be any way of knowing.  Consequently a whole new form of government is going to take over this country, and I know I won't live to see you another time.  My life is in danger here. Do I sound screwy?, Well I don't know what can be done, Mr. Ruby, because I don't know what you anticipate we will encounter., Then you don't stand a chance, Mr. Chief Justice, you have a lost cause. All I want is a lie detector test, and you refuse to give it to me. Because as it stands now - and the truth serum - how do you pronounce it - Pentothal - whatever it is. They will not give it to me, because I want to tell the truth... And then I want to leave this world., ",jfk,m104,1991,"['biography', 'drama', 'history', 'mystery', 'thriller']",formal
14288,14288,L338296,"Help! Help! I'm drowning!, I doubt it. The water is only an inch deep., It could have been quicksand! I might have been sucked to my death.  Where is this place?, A forest near the Valley of Needles., Blast! A thousand miles off course. Well, I was rushed. There was a certain difference of opinion concerning a venison pie. The foolish man left it sitting on his windowsill. What did he expect?, Perhaps he expected to eat it., For that rudeness, peasant lout, I am going to leave you hanging by your heels when I depart. Which is right now., ",krull,m113,1983,"['fantasy', 'action', 'adventure', 'sci-fi']",formal
14301,14301,L338326,"They stand at the edge of the grave and make jokes.  Do you know who I am, sprout? I am Torquil, Lord of the forest. My men follow no man but me, and I follow no man at all., You will follow me., And in the few seconds before I dice you to crow-food, tell me why I am going to follow you., So your sons will speak of you to your grandsons, and your grandsons to their grandsons., ",krull,m113,1983,"['fantasy', 'action', 'adventure', 'sci-fi']",formal
14820,14820,L346446,"Start acting like you're worthy of this mission... Here.  Whatever you do, don't dare drop it., Nay, Sire, I'll cling to it as to life itself..., Good, lad... Here, Jack, give me a hand with the windlass... There's a good fellow..., ",legend,m118,1985,"['fantasy', 'adventure', 'romance']",formal
15688,15688,L357620,"Yes, of course, your brother is a problem. It was to be expected., I knew you'd understand. That's why I came to you for help., You must not look to me for help. Your brother is no longer my problem. He is now your problem, Conway., Mine?, Because, my son, I am placing in your hands the future and destiny of Shangri-La.  For I am going to die., ",lost horizon,m124,1937,"['adventure', 'drama', 'fantasy', 'mystery']",formal
17569,17569,L393003,"Just for the fun of it.--You see the one that makes it back home in the fastest time, I am going to enter in the nationals., Wonderful!, ",mr. smith goes to washington,m139,1939,['drama'],formal
17640,17640,L396133,"Were you given an assignment to follow the activities of Longfellow Deeds?, Yes., Did you subsequently write a series of articles about him?, Yes!, Are these the articles?, Yes!, Were you present when all these things took place?, Yes!, Are they true!, NO!!, But they did take place?, They're colored! Just to make him look silly!, And you saw them happen?, Yes, but I, That's all, Miss Bennett., It isn't all! I'd like to explain, That's all, Miss Bennett. That's all., ",mr. deeds goes to town,m140,1936,"['comedy', 'romance']",formal
18012,18012,L400835,"O'Connell! I am going to kill you for this!, Sounds familiar., ",the mummy,m142,1999,"['action', 'adventure', 'fantasy']",formal
18238,18238,L406609,"But, sire, Your Majesty would lay Paris open to being sacked.  The enemy is outside the gates with more than 120,000 men.  Besides this, I left the city under the terms of a treaty and I am forbidden to reenter Paris., A treaty?  Don't be ridiculous. What treaty is this?  Who made it? Who has been giving orders?, I don't know the details of the treaty, sire, Marshal Mortier sent me word of its having been agreed to, and he said that I was to take the army and make for Fontainebleau., But who made this treaty?, I believe it was arranged by Marshals Mortier and Marmont.  I must explain to you that we have had no orders all day.  Each marshal has been keeping his own position., Who sent my wife and son out of Paris?, I don't know, sire., And where is Joseph?, I don't know what has happened to Prince Joseph., What cowardice!  What treason! Joseph has ruined everything.  How could they all lose their heads. They knew I was coming up fast. Victory was just within grasp. Come, come, turn your troops around, General Belliard., ",napoleon,m144,1995,"['family', 'adventure']",formal
18239,18239,L406596,"Well, Belliard, what's this?  What are you doing here?  Where is the enemy?, They are at the gates of Paris, sire., And where is the army?, It is on this road, sire, following me., And who is defending Paris?, Paris is evacuated, sire.  The enemy is to enter at nine o'clock tomorrow morning.  The National Guard is on duty at the gates., Paris has surrendered?!  I don't believe it., Unhappily, it is true, sire., But where are my wife and son? What's become of them?  Where is Marmont?  Where is Mortier?, The Empress, your son and the whole court left two days ago for Rambouillet.  Marshals Mortier and Marmont are probably still in Paris, completing the arrangements., ",napoleon,m144,1995,"['family', 'adventure']",formal
18240,18240,L406700,"Who is there?, Bertrand, sire., I have just had the most vivid... dream... about Josephine., Yes, sire?, She was sitting there... and it was as if I had last seen her only the night before... She hadn't changed -- she was still the same -- still completely devoted to me... and she told me we were going to see each other again and, never again, leave each other... She has promised me. Did you see her?, No, sire... I was asleep., I wanted to kiss her, but she didn't want to kiss me... She slipped away, the moment I wanted to take her in my arms., ",napoleon,m144,1995,"['family', 'adventure']",formal
18241,18241,L406635,"But did she have the best doctors? Wasn't there any chance at all to save her?, I don't know, sire -- she had the Tsar's personal physician., She should have had Larrey or Corvisart.  They might have saved her... But why didn't anyone even write to me?  Can you believe that no one even bothered to write to me? Would you have believed that I should read such news in a newspaper?  How incredible!, That is incredible., Ah, my poor Josephine.  She was the most alluring, most glamorous creature I have ever known -- a woman in every sense of the word, and she had the kindest heart in the world.  She may have been a liar and a spendthrift, but she had something that was irresistible -- she was a women to her very fingertips... How impossible it is to believe that she is dead., I have never heard an unkind word about her spoken., I suppose I might blame her for opening her house to the men most responsible to my downfall, but how can I?  She was on her own again, she had to look after her own affairs, and how can one blame her for having her head turned by the attention of Kings?, ",napoleon,m144,1995,"['family', 'adventure']",formal
18883,18883,L419675,"But, darling, you can't do that., Comrades! Good people of France!, Now, Ninotchka... please!, They are all Duchesses here... thousands of Duchesses... and I am going to tell them., ",ninotchka,m149,1939,"['comedy', 'romance']",formal
22610,22610,L504372,"I am going to get my nut on this trip, Miles. And you are not going to fuck it up for me with all your depression and anxiety and neg-head downer shit., Ooooh, now the cards are on the table., Yes they are. And I'm serious. Do not fuck with me. I am going to get laid before I settle down on Saturday. Do you read me?, Sure, big guy. Whatever you say. It's your party. I'm sorry I'm in the way and dragging you down. Maybe you'd have a better time on your own. You take the car. I'll catch the train back., No, see, I want both of us to get crazy. We should both be cutting loose. I mean, this is our last chance. This is our week! It should be something we share., ",sideways,m178,2004,"['comedy', 'drama', 'romance']",formal
