,ID,Conversation.ID,Text,Movie.Title,Movie.ID,Release.Year,Genre,Formal/Informal
39420,39420,L149740,"Unbelievable. Some fag, no offense -, - none taken -, - wrote a letter to this chick and saying shit about me., Any ideas who it could be?, Blaine, if I knew who it was that person wouldn't be alive right now., Where did you say she's from?, Kansas. Who the hell do I know in Kansas?, Greg McConnell., The football stud?, He's from Kansas City. I wouldn't be surprised if he was your rat., It would make sense. McConnell hates me. I fingered his girlfriend at the game last year., I don't think that bothered him., What do you mean?, Let's just say Greg likes tackling tight ends on and off the field., Are you shitting me?, I shit you not. McConnell used to sneak in my dorm room drunk every month. We'd go at it for a while, then as soon as he'd cum, he starts freaking out. You know -  ""What are you doing, man? I'm not a fag. I'll kick your ass if you say anything.""  It's like, for Christsakes Greg, you're gay, deal with it. The only reason why I let him continue with his charade is because he's got a mouth like a Hoover., Too bad he's in Kansas this summer., Not anymore. Football team started practice last week. He's already called me to hook up., Really. You think you could arrange a little get together with him tonight on my behalf?, Hmmm. I do believe Bravo is showing Spartacus on television tonight., Outstanding., Don't think it's not going to cost you., No problem. Just make sure your front door is unlocked. Shall we say the ""stroke of midnight"" no pun intended?, ",cruel intentions,m312,1999,"['drama', 'romance', 'thriller']",informal
39492,39492,L149983,"I hate when things don't go my way. It makes me so horny., I hate it too., ",cruel intentions,m312,1999,"['drama', 'romance', 'thriller']",informal
41077,41077,L172768,"Whoa. What was that?, What?, Your mom made a move on me., She did not., Who knows? Maybe someday I'll be your new daddy., LLOYD, she's my mom., I can't help my heart. And when I'm your dad, you'll have to do as I say., Will not., Don't use that tone with me, young man., Shut up!, I will stop this car right now., You're not my real dad., You take that back!, Shut Up! Buttlick!, Where did you learn that word?, I learned it from listening to you! I hate you!, Kids., ",dumb and dumberer: when harry met lloyd,m327,2003,['comedy'],informal
42981,42981,L198328,"Listen ... why don't you come out to the house this weekend.  Say hello to the kids. They've grown., I hate your kids, Frank., You're their uncle., Only by relation.  Besides, they hate me, too., They don't.  They're always asking about you., They tried to electrocute me, Frank., It was an accident., It was no fucking accident, Frank. The little one ..., Cindy., She threw a goddamn radio into the bathtub. How do you explain that?, She didn't know what she was doing. You're too sensitive., You got weird kids, Frank., Look, I just thought if you came out you might see what you're missing., ",the fabulous baker boys,m342,1989,"['drama', 'music', 'romance']",informal
51246,51246,L337636,"Owwww...You're hurting me... You're hurting me...I hate you ...I hate you..., You're no bargain either, pal., I want my mommy...I want my mommy.., ",kramer vs. kramer,m416,1979,['drama'],informal
52048,52048,L354229,"Never thought I'd see the day a buddy of mine was dating a woman with three up and three down on her shoulder., I think it's beyond what you'd call dating., You going to get married?, Maybe., You met her family? They gonna be cool about you being a white guy?, Priscilla says they think any woman over 30 who isn't married must be a lesbian. She figures they'll be so relieved I'm a man--, Always heartwarming to see a prejudice defeated by a deeper prejudice.  But marriage, man--I did two tours in Southeast Asia and I was married for five years--I couldn't tell you which experience was worse., ",lone star,m423,1996,"['drama', 'mystery', 'romance', 'western']",informal
1294,1294,L17395,"Twenty five minutes. They should be here any moment., They better. Fuel's almost gone., ",air force one,m11,1997,"['action', 'drama', 'thriller']",informal
2980,2980,L60315,"Jesus, it's too damn bright in here... Like a goddamn spotlight... I'm goin' blind..., This?, Yeah... too bright..., ",backdraft,m25,1991,"['action', 'crime', 'drama', 'mystery', 'thriller']",informal
29305,29305,L10233,"Need some help?, Thanks.  No, I can handle it.  Bud... there won't be enough to run the heaters.  In a couple hours this place is going to be as cold as a meat locker., What about O-2?, Brace yourself.  We've got about 12 hours worth if we close off the sections we're not using., The storm's gonna last longer than 12 hours., I can extend that.  There's some storage tanks outboard on the wrecked module.  I'll have to go outside to tie onto them., ",the abyss,m232,1989,"['action', 'adventure', 'drama', 'sci-fi', 'thriller']",informal
56008,56008,L411340,"Gus?, No, it's the Great and Powerful Oz. Now listen--you're in over your head. This is how it's gonna work. I review the tapes, I find your story., What if I say no?, I bet Good Housekeeping would go gaga over the cole slaw piece., ",never been kissed,m458,1999,"['comedy', 'drama', 'romance']",informal
19911,19911,L435683,"But lots of our people don't read, man. They need strong imagery to help them out., Yeah... then shouldn't this be all of us together., Trust me Huey, this picture will be worth a thousand words. Now have you given any thought to that Peace and Freedom Party thing. They really want to hook up with us. Do a rally together. Hell it'd broaden our base of visibility., Yeah, but aligning with white organizations. I'm not sure now's the time., The time, my friend, is what Sartre called, ""the moment the match is being put to the fuse."" Question is, is the hand holding that match gonna be black or white., ...no full fledge alliance. But I think we should do a rally with them. Show that there's some common ground between Black and White. You all with that?  All right then Eldridge, set it up., ",panther,m156,1995/I,['drama'],informal
42260,42260,L190428,"You wouldn't happen to have a little time right now, would you, Donna?, For what?, Well, I was gonna head over to the Browns now.  I was thinking -- Mandy really values your opinion ..., ",erin brockovich,m336,2000,"['biography', 'drama', 'romance']",informal
1,1,L870,"I'm kidding.  You know how sometimes you just become this ""persona""?  And you don't know how to quit?, No, Okay -- you're gonna need to learn how to lie., ",10 things i hate about you,m0,1999,"['comedy', 'romance']",informal
4,4,L860,"Then Guillermo says, ""If you go any lighter, you're gonna look like an extra on 90210."", No..., ",10 things i hate about you,m0,1999,"['comedy', 'romance']",informal
9,9,L401,"Sure have., I really, really, really wanna go, but I can't.  Not unless my sister goes., I'm workin' on it. But she doesn't seem to be goin' for him., ",10 things i hate about you,m0,1999,"['comedy', 'romance']",informal
91,91,L294,"You got it, Verona.  I pick up the tab, you do the honors., You're gonna pay me to take out some girl?, I can't date her sister until that one gets a boyfriend.  And that's the catch. She doesn't want a boyfriend., How much?, ",10 things i hate about you,m0,1999,"['comedy', 'romance']",informal
129,129,L639,"Why'd you let him get to you?, Who?, Dorsey., I hate him., I know.  It'd have to be a pretty big deal to get you to mainline tequila. You don't seem like the type., Hey man. . .  You don ' t think I can be ""cool""?  You don't think I can be ""laid back"" like everyone else?, I thought you were above all that, You know what they say, ",10 things i hate about you,m0,1999,"['comedy', 'romance']",informal
132,132,L564,"What's this?, ""I'm getting trashed, man."" Isn't that what you're supposed to do at a party?, I say, do what you wanna do., Funny, you're the only one, ",10 things i hate about you,m0,1999,"['comedy', 'romance']",informal
150,150,L728,"Hey there.  Tired of breathing?, Hi., Cool pictures.  You a fan?, Yeah.  I guess., ",10 things i hate about you,m0,1999,"['comedy', 'romance']",informal
155,155,L383,"You two are gonna help me tame the wild beast?, We're your guys., ",10 things i hate about you,m0,1999,"['comedy', 'romance']",informal
165,165,L917,"What do you wanna watch?  We've got crap, crap, crap or crap, Dr. Ruth?, ",10 things i hate about you,m0,1999,"['comedy', 'romance']",informal
269,269,L3177,"I'm not a whore.  I'm not a whore., I know., You don't know.  I'm sorry.  I was desperate.  That's not me.  I shot a cop.  Can you imagine what they'll do to me when I got to prison?, They're not gonna send you right back., I'm sorry.  I didn't mean to...I'm glad. Actually I'm glad it's over.  All this time.  Hiding.  Never being able to look anyone in the eyes. Always afraid that someone would find out who I was.  Never trusting anyone..., ",15 minutes,m2,2001,"['action', 'crime', 'drama', 'thriller']",informal
281,281,L3498,"The public doesn't have any idea what we do and now you're going to define our image!  This is going to be our Rodney King!, What was I supposed to do?  The guy tried to mug me.  I was gonna send a cop back - I just forgot., Forgot?  You handcuffed a civilian to a tree?!, Chief - I know I screwed up - but this guy was no innocent civilian., Well this is gonna end your career and probably mine., End my career?, How are you going to fight this?  Maybe if Oleg hadn't gotten away and you'd been on the front page, as a hero, this thing would be easier to fight.  You'd have the good to weight against the bad! It's unfortunate that I have to make decisions based upon your press coverage but there's nothing I can do!  Gimme your shield., But Chief?  Over this??, There's nothing to talk about.  Get a good lawyer.  You're suspended until your trial., ",15 minutes,m2,2001,"['action', 'crime', 'drama', 'thriller']",informal
290,290,L2936,"Only one guys checked in?, Yeah., C'mere.  You wanna go to homicide school?  Here - make yourself useful., ",15 minutes,m2,2001,"['action', 'crime', 'drama', 'thriller']",informal
292,292,L2630,"I'm gonna propose., When?, Tomorrow.  At lunch., You ready?, ",15 minutes,m2,2001,"['action', 'crime', 'drama', 'thriller']",informal
293,293,L2602,"It was freaky, I'll tell you.  Stupid kid., What's the kid gonna say - sorry? Meanwhile I'm not here anymore. Like last week - we were at the morgue and this guy was all chopped up - spleen here - liver there - his heart in a pan. Six hours ago this guy was walkin' his dog or buyin' a quart of milk.  Who knows?  But some kid's robbed him for $3 or some shit and shot him and now you can't tell if he's a piece of beef or a human being and I'm thinkin' that's me. Sooner or later.  That's me., ",15 minutes,m2,2001,"['action', 'crime', 'drama', 'thriller']",informal
299,299,L2964,"Who's there?, Police.  We'd like to ask you a few questions., I have nothin' to say.  If you wanna contact my attorney..., Homicide, Miss Hearn.  It's Detective Eddie Flemming.  Open up., ",15 minutes,m2,2001,"['action', 'crime', 'drama', 'thriller']",informal
301,301,L3223,"Yeah, just her in the shower.  Nothing happened.  Look, I'm sure you probably think I'm a fool and I fucked up, but..., No, I don't think you were a fool, I just think you were stupid about it.  I mean, to say the least, you outta know better.  You don't know her well enough. She's got the potential to fucking hang you even if she suggests that you made a pass at her, it's fuckin' over.  You can deny it all you want, but it will not make one fucking bit of difference. You're dead., I told you, you know, I thought I was doing the right thing, you know, I think she's innocent., Well, it's not up to you to decide whether she's innocent or not.  Don't you understand, that's why you're a professional., But, I mean, didn't you ever go out on a limb for somebody?  I mean, you shoulda heard her there.  Tellin' her whole story...I believed her., How you go out on a limb for somebody is by giving her a number of an Immigration lawyer.  Here, here's a number of an Immigration lawyer.  That's how you help her. But you can't get involved in her like that.  You're gonna jeopardize your career, your life and you're gonna jeopardize my case.  And lemme give you another piece of advice.  Maybe you don't watch TV but I'll let you in on a little secret - the whole fuckin' world watches television.  And when you get out there, they know your face.  And the little fame, the little fuckin' itty bitty fame that I get in this city makes it a lot easier for my job.  And I get more done because of it., ",15 minutes,m2,2001,"['action', 'crime', 'drama', 'thriller']",informal
347,347,L2850,"It's an outcall service run out of an apartment.  I don't meet the other girls.  Aren't you gonna get undressed?, Where is escort service?, That's confidential.  Could you put the money on the dresser?, I like to talk to the person who runs the service.  Can you give me address?, Look.  Do we have a problem here? There's no reason to have a problem. I'm gonna make you feel real good.  You wanna Czech girl? After I'm done with you, you won't miss her.  Now why don't you pay me?, ",15 minutes,m2,2001,"['action', 'crime', 'drama', 'thriller']",informal
390,390,L3262,"I know., What do you mean you know?  He told you he was gonna propose to me?, Well, he..., I want to hear everything he said., I'm trying to tell you., Alright.  Go ahead., That morning.  He was talking to me and Leon about marriage., Oh my G-d.  We were having lunch here. He started making overtures - talking about little shoes next to his in his closet but I got a call to anchor - and I walked out on him.  I walked out on him when he was trying to ask me to marry him!!, ",15 minutes,m2,2001,"['action', 'crime', 'drama', 'thriller']",informal
395,395,L2771,"You okay?, A dog pissed on me!!  I'm gonna sue you for this!  You violated my civil rights!, Your civil rights?!  You tried to rob me!  I could arrest you right now! You're lucky you're walking away from this.  Now get outta here., ",15 minutes,m2,2001,"['action', 'crime', 'drama', 'thriller']",informal
399,399,L2808,"What's that on your forehead, Max? That's a nice attention getter., Yeah, I'm religious.  I'm not an Atheist like you!  Now, are you guys gonna arrest me, or not?, How did you start the fire this time?, I used an accelerant., Yeah?  What kind?, Hey, by the way, I'm really sorry about your wife leavin' you., ",15 minutes,m2,2001,"['action', 'crime', 'drama', 'thriller']",informal
412,412,L3422,"What are you gonna do?, Don't you get it?  He knew he was gonna get caught!  That's why he videotaped Eddie's murder - he thinks he's gonna get off., Don't stoop to his level!, ",15 minutes,m2,2001,"['action', 'crime', 'drama', 'thriller']",informal
491,491,L4562,"Maybe that's where I'm gonna cut your throat., He's just kiddin', you just keep doin' what I tell ya, you'll be okay., ",48 hrs.,m4,1982,"['action', 'comedy', 'crime', 'drama', 'thriller']",informal
493,493,L4501,"I want to drive awhile., I ain't tired yet., Maybe after we get done with him I'm gonna buy us some girls., Whaddya mean, buy?, Pros., ",48 hrs.,m4,1982,"['action', 'comedy', 'crime', 'drama', 'thriller']",informal
501,501,L5175,"I'm candy..., Excuse me, baby, but if i don't get some action tonight, I'm gonna bust.  You interested?, Hey, what kind of talk is that?, Oh ... You're a schoolteacher..., No, I go to a school to learn how to do hair. It's a government program. But really I want to be a model - and I am definitely not sellin'., Goodbye., ",48 hrs.,m4,1982,"['action', 'comedy', 'crime', 'drama', 'thriller']",informal
503,503,L5321,"You and the other one, you're still Billy's girls. You always were his girls..., Yeah.  Sure, i'm crazy in love with him, who wouldn't be..., You're gonna help us take him., No chance., He can live or die ... You let us in and he's got a chance to make it.  Otherwise, he gets ventilated., ",48 hrs.,m4,1982,"['action', 'comedy', 'crime', 'drama', 'thriller']",informal
507,507,L5346,"I got hit.  I can't believe it. I got shot., You're done.  End of story., I ain't gonna beg for my life. It ain't cool., ",48 hrs.,m4,1982,"['action', 'comedy', 'crime', 'drama', 'thriller']",informal
549,549,L5011,"We split 50-50?, Not likely, convict., You gonna let me keep any of it?, Depends on how things work out. I believe in the merit system. So far you haven't built up any points., ",48 hrs.,m4,1982,"['action', 'comedy', 'crime', 'drama', 'thriller']",informal
550,550,L5007,"Just tell me about the money., Me and my bunch hit a dealer in the middle of a sale. It's the kind of money nobody ever reports stolen. I was sittin' pretty, livin' in the high cotton, then somebody fingered me for another job. ... Some psycho who's out there capping people with some cop's gun., He's after your money., You catch on real fast...Okay, Jack, let's talk deal. How much of my money you gonna let me keep?, ",48 hrs.,m4,1982,"['action', 'comedy', 'crime', 'drama', 'thriller']",informal
554,554,L4969,"This sucks.  A maniac gets hold of my gun and goes all over the streets killing people with it. So, instead of me being where I oughta be, which is in bed giving my girl the high, hard one, I'm out here doing this shit, roaming around with some overdressed, charcoal-colored loser like you., You wanna leave, man?  Let me take care of Ganz all by myself., You?  Don't make me laugh.  You can't take care of shit.  You've been dicking me around since we started on this turd-hunt.  All you're good for is games... So far, what I got outta you is nothin'..., I'm impressed with you too, Jack you did a real good job of busting up a couple of dykes bedded down for the night., Luther knew more than he told me and so do you...Now you better tell we what the fuck this is all about.  I gave you 48 hours to come up with something and the clock's runnin' ..., ",48 hrs.,m4,1982,"['action', 'comedy', 'crime', 'drama', 'thriller']",informal
559,559,L4893,"I'm gonna enjoy this ... here, I'll even loan you my badge., I thought you said bullshit and experience are all it takes., ",48 hrs.,m4,1982,"['action', 'comedy', 'crime', 'drama', 'thriller']",informal
560,560,L4887,"I'll tell you what happens if you lose... you tell the truth for once., What are you talkin' about?, You tell me what Ganz busted out for, he's after a lot more than just gettin' out of jail.  And whatever it is, you're part of it., I don't know what you're talking about. I just wanna see Ganz nailed., The bet's off., ",48 hrs.,m4,1982,"['action', 'comedy', 'crime', 'drama', 'thriller']",informal
561,561,L4882,"Hey, you wanna bet?, I got two problems.  Number one, I'm not playin' games.  Number two, you got nothin' to bet with., If we come outta this joint with Ganz' phone number, or a dead Indian, or anything else useful, then you could turn the other way for half an hour while I get laid..., Why?  Anybody that talks about women as much as you do probably can't get it up anyway., That's never been one of my problems., ",48 hrs.,m4,1982,"['action', 'comedy', 'crime', 'drama', 'thriller']",informal
563,563,L4873,"Well?, It's a long shot, but...Billy used to tend bar here a few years back. I heard him talk about it., This part of town, they'll make us for heat the second we walk in. Just back me up like you've got a piece..., Back you up?  Now why would I wanna do that?, If they kick my ass, they'll sure as hell carve yours up..., But you can handle it all right, huh? Real amazin' how far a gun and a badge can carry some cats..., Bullshit.  Attitude and experience get you through..., ",48 hrs.,m4,1982,"['action', 'comedy', 'crime', 'drama', 'thriller']",informal
566,566,L4863,"Now, where we goin', convict?, Mission District.  Gonna find us an Indian., ",48 hrs.,m4,1982,"['action', 'comedy', 'crime', 'drama', 'thriller']",informal
570,570,L4825,"What do you think?, I think you better put him on ice, man., He's gotta take that call ... if there is one., If you let him run around till Tuesday, he's gonna run right to Ganz and warn him. Ain't you, motherfucker?, ",48 hrs.,m4,1982,"['action', 'comedy', 'crime', 'drama', 'thriller']",informal
577,577,L4771,"Hey, no way.  Take off the bracelets or no deal., You just don't get it, do your Reggie?  There isn't any deal. I own your ass., No way to start a partnership., Get this.  We ain't partners. We ain't brothers.  We ain't friends. I'm puttin' you down and keepin' you down until Ganz is locked up or dead.  And if Ganz gets away, you're gonna be sorry we ever met., Shit.  I'm already sorry., ",48 hrs.,m4,1982,"['action', 'comedy', 'crime', 'drama', 'thriller']",informal
581,581,L4743,"Yeah?, I can deliver Ganz.  But you gotta get me outta here first., You're crazy., I can help you, man, but you gotta get me out.  I got to be on the street.  Get me outta here., What's the big deal about you bein' on the street?, I got a lot to protect., Bullshit., It's the only way you're gonna get Ganz., I'll think about it., ",48 hrs.,m4,1982,"['action', 'comedy', 'crime', 'drama', 'thriller']",informal
582,582,L4739,"Yeah, I noticed..., Ganz is in jail.  He's gonna be there two years after I'm on the street., Didn't work out that way.  He busted out with a big Indian. They capped two guards on a road gang. Nice meeting you Reggie., ",48 hrs.,m4,1982,"['action', 'comedy', 'crime', 'drama', 'thriller']",informal
586,586,L5242,"He's got more brains and more guts in one corner of his asshole than any cop I've worked with., Just cause you say it with conviction don't mean shit to me... How you gonna take to a pink slip, huh?., ",48 hrs.,m4,1982,"['action', 'comedy', 'crime', 'drama', 'thriller']",informal
594,594,L4642,"Somebody steals your gun, you're supposed to file a report., Are you gonna tell me about police procedure?  Do me a favor, don't give me a bunch of crap., I guess when two cops die on account of your fuck up you want to keep it as quiet as possible..., ",48 hrs.,m4,1982,"['action', 'comedy', 'crime', 'drama', 'thriller']",informal
601,601,L4685,"I think I wanna have a discussion about it with any of the ones still walking.  Can we find them?, Here's the file. Cates checks the file., One of  em's in the slam., ",48 hrs.,m4,1982,"['action', 'comedy', 'crime', 'drama', 'thriller']",informal
607,607,L4821,"He ... he wants me to help him skip town., When? How?, I dunno ... he's gonna call me..., ",48 hrs.,m4,1982,"['action', 'comedy', 'crime', 'drama', 'thriller']",informal
621,621,L4836,"Just one.  Some lady called.  Said she's a little hot-headed sometimes... But she still wants her occasional roommate. She'd like to talk it over after she gets off work tonight... if it's humanly possible...., Elaine, look, I'm in the middle of sone stuff right now... I'm not gonna have time to come by. I don't know when I can get there., ",48 hrs.,m4,1982,"['action', 'comedy', 'crime', 'drama', 'thriller']",informal
622,622,L4712,"Look, spare me the macho bullshit about your gun..., Bullshit?  I'll tell you about bullshit.  My gun's a real weapon in the hands of a real maniac who knows how to use it.  It isn't my macho bullshit that's killing people, my gun is ..., Look, Jack, if you make everything your personal responsibility, you'll turn into a bad cop.  It's not a practical way to function..., I didn't get burned, two cops did. Listen, I'll tell you about personnel responsibility.  I like to get the job done right.  And if I don't get my job done right... I'm for shit., Here it comes again ... the sacred job..., That's right.  I'm not like you. I'm not gonna sit on my ass wondering what's right and what's wrong... There's a psycho out there killing people with my gun and I'm gonna get him.  Because it's my job. And if you don't get that..., I get that. The job first. Everything else, especially me, second. I get it. I don't like it., ",48 hrs.,m4,1982,"['action', 'comedy', 'crime', 'drama', 'thriller']",informal
647,647,L5121,"Yeah, I know that, but this is me and we're old friends. I haven't got the money so what are you gonna do about it?, Give it back., Try and take it., ",48 hrs.,m4,1982,"['action', 'comedy', 'crime', 'drama', 'thriller']",informal
725,725,L6020,"My main man! Please don't leave me here alone. My head's killing me and my adoring fans are gonna tear me apart! Get me outta here!, I'll take you to the bar, after that, you're on your own., Oh, yes! Do that! You treat me right, man. Tell me all about yourself, your roots, your personal life, your childhood dreams..., I don't think this is a good time..., ...You got brothers and sisters? What about your dad? Tell me about your dad! What was he like? Physically? Big, I suppose?, Yeah, very big, a giant., I didn't have a dad... never saw him... never even heard him. 50 billion people listen to me every day... and he doesn't hear me..., ",the fifth element,m5,1997,"['action', 'adventure', 'romance', 'sci-fi', 'thriller']",informal
727,727,L5924,"...Quiver ladies, he's gonna set the world on fire right here from 5 to 7! You'll know everything there is to know about the D-man. His dreams, his desires, his most intimate of intimates.  And from what I'm looking at intimate is the stud muffin's middle name. So tell me my main man... you nervous in the service?, Uh... not really., ",the fifth element,m5,1997,"['action', 'adventure', 'romance', 'sci-fi', 'thriller']",informal
