,ID,Conversation.ID,Text,Movie.Title,Movie.ID,Release.Year,Genre,Formal/Informal
8071,8071,L241822,"Montgomery, why do they call you ""Flea""?, It's really ""F. Lee Montgomery"" -- but that gets whittled down to just ""Flea.""  For short, ma'am., So it really has nothing to do with actual brain size?, No, ma'am., Well, Flea, I appreciate the respect you just showed me.  But I don't need it and don't want it -- not that kind of respect, anyway.  It's just gonna hurt us both, okay?, I'll work on it, ma'am., Do that., ",g.i. jane,m66,1997,"['action', 'drama']",informal
8149,8149,L247221,"Great stuff, Animal. Weren't you scared?, Sure I was. I thought Lucy was gonna kill me., ",godzilla,m67,1998,"['action', 'horror', 'sci-fi', 'thriller']",informal
8550,8550,L234094,"You keep hittin' him like that, he ain't gonna look like he broke in anymore, he gonna look like someone beat him up and then shot him., You're right., ",get shorty,m70,1995,"['comedy', 'crime', 'thriller']",informal
8552,8552,L234065,"Hell, why not just shoot her? Why not shoot everybody. Fuckin' shoot me. Shoot the fuckin' president?, Don't fade on me now, Bear. Not unless you wanna hold Farrah on your lap in a room fulla felons., ",get shorty,m70,1995,"['comedy', 'crime', 'thriller']",informal
8558,8558,L233960,"He's gonna plea-deal his way out. Give up this ace stunt man now one of the West Coast dope kings, if they go easy on the Cat., Come here, Farrah..., ",get shorty,m70,1995,"['comedy', 'crime', 'thriller']",informal
8560,8560,L233946,"You see the paper?, I seen it, but I don't believe it. Says Harry shot Ronnie five times. Four to the chest and one through his foot., His foot. Jeez, poor Ronnie..., Yeah, I'm really gonna miss him., ",get shorty,m70,1995,"['comedy', 'crime', 'thriller']",informal
8562,8562,L233569,"And I mean high up in it.  That's why Harry's gonna make Mr. Lovejoy with me, not Chili Palmer., Mr. Lovejoy? That's cute, Bo., Doesn't matter what it's called, Harry's got Martin Weir and it's gonna be big., They all sound big at the talking stage., ",get shorty,m70,1995,"['comedy', 'crime', 'thriller']",informal
8563,8563,L233566,"Cat, that's the lamest idea I've ever heard., Yeah, well, I'm bored, Bear. I wanna make movies., ",get shorty,m70,1995,"['comedy', 'crime', 'thriller']",informal
8567,8567,L233814,"Look, there's no fuckin' way I'm gonna give you the key, outside of you point a gun at my head. Then we might have something to talk about. Now step away from the car., I don't need a gun. Where is it? If it isn't on you, it's around here someplace., ",get shorty,m70,1995,"['comedy', 'crime', 'thriller']",informal
8570,8570,L233857,"You know, you speak very good English, Mr. Escobar., I went to UC San Diego.  We're gonna spend the weekend at the Universal Sheraton. We're gonna take the tour. See the shark. Check out the Miami Vice Action Spectacular. After, we'll come here, get our money., ",get shorty,m70,1995,"['comedy', 'crime', 'thriller']",informal
8572,8572,L233844,"He's my sister's kid. No papa. Not too bright. Personally, I think he's a retard. I only gave him the job as a favor for my sister, you understand?, Sure. Family. I know how that goes., He comes up here with our product. He suppose to come home with five hundred thousand dollars. He never shows up. Meanwhile, my sister's going crazy calling me all the time worried about him. Me, I just wanna know what happened to my focking money., Well, I don't know. I gave the man his money, sent him on his way., You gave him the money?, I gave him a key to a locker that had the money in it., Now why would you do that? Put the money in a locker?, Because there were a zillion DEA guys hanging around the terminal., A zillion, huh? That's a lot., ",get shorty,m70,1995,"['comedy', 'crime', 'thriller']",informal
8574,8574,L234079,"Only this time, no John Wayne and Dean Martin shooting the bad guys in El Dorado., It was Rio Bravo. Robert Mitchum was the drunk in El Dorado, Dean Martin in Rio Bravo, practically the same part. John Wayne, he also did the same thing in both. He played John Wayne., Man, I can't wait for you to be dead., Bear, you're not really gonna -, ",get shorty,m70,1995,"['comedy', 'crime', 'thriller']",informal
8579,8579,L234034,"How 'bout I give you to three, then I organize your fuckin' brains all over the wall back there. One..., What, you gonna shoot me now, Bo?, In just a second. Two..., I don't believe this., Three., ",get shorty,m70,1995,"['comedy', 'crime', 'thriller']",informal
8583,8583,L233492,"You know how to write one of these?, There's nothin' to know. You have an idea, you write down what you wanna say. Then you get somebody to add in the commas and shit where they belong, if you aren't positive yourself. Maybe fix up the spelling where you have some tricky words... although I've seen scripts where I know words weren't spelled right and there was hardly any commas in it at all. So I don't think it's too important. Anyway, you come to the last page you write in 'Fade out' and that's the end, you're done., That's all there is to it, huh?, That's all., ",get shorty,m70,1995,"['comedy', 'crime', 'thriller']",informal
8586,8586,L233471,"Says here you're getting Martin Weir for the part of Lovejoy., Yeah, we're getting Martin., No shit, come on. How you gonna do that?, I put a gun right here...  ...and I tell him, 'Sign the paper Marty or your fuckin' dead.' Like that., I wonder, would that work?  You know who I see for Al Roxy? Harvey Keitel. The man could do it in his sleep., Harvey Keitel. Yeah. Maybe. He was pretty good in the movie ""Fingers""., I missed that one. Or, hey, you know who else? Morgan Freeman. You know Morgan?, Yeah, Morgan Freeman. But he's a colored guy., So what? Where's it say in this script he's white? Color is what the part needs, man, somebody to do it has some style. The way it is now, Ronnie could do it, play himself, some cracked out asshole.  So whatta you think of the script?, ",get shorty,m70,1995,"['comedy', 'crime', 'thriller']",informal
8589,8589,L233463,"You understand I knew Harry was lying, saying this wasn't any good, but holding on to it, man, like you have to break his fingers to get it from him., That's funny, I was just wondering what I was gonna break of yours to get it away from you., ",get shorty,m70,1995,"['comedy', 'crime', 'thriller']",informal
8595,8595,L233669,"How 'bout another one for Mr. Zimm. A double., You're gonna just give me five hundred grand?, We'll talk about that, Harry. But first I gotta know, how'd you hook up with Chili Palmer., ",get shorty,m70,1995,"['comedy', 'crime', 'thriller']",informal
8713,8713,L233346,"I hate to say I told you, but I did. I told you don't start nothing with him that time., You said don't say nothing and I didn't., No, you just broke his fuckin' nose instead., You gonna start that again? You're just like him, all you got room for in your brain is one fuckin' thing., All I know is he came by the barber shop, all fuckin' undone, wanting to know where you were staying in Vegas. I told him I don't know. I still don't., How'd he know I was in Vegas? You tell him?, He already knew it., Yeah, well, I'm in L.A. now., Whatta you doing out there?, I'm going into the movie business., What're you talking about? You wanna be a movie star?, I'm thinking about producing., How you gonna do that? You don't know shit about making movies., I don't think the producer has to do much, outside of maybe knowing a writer., Hey, Chil? I think you're fulla shit., ",get shorty,m70,1995,"['comedy', 'crime', 'thriller']",informal
8716,8716,L233009,"You sure it was Ray Bones took the coat?, That's what the guy said., Tomorrow, I see on the TV weather, it's gonna be nice and warm. You won't need the coat., ",get shorty,m70,1995,"['comedy', 'crime', 'thriller']",informal
8717,8717,L232981,"Momo could buy it, I could run it for him. Show some Cagney films., What's Momo gonna want with an old place, shows old movies people don't care about no more. Outside of maybe turnin' it into a porno house, I don't think he's gonna give much of a fuck. And you already got a job., ",get shorty,m70,1995,"['comedy', 'crime', 'thriller']",informal
8721,8721,L233447,"All these camera moves and weird angles and shit are gonna distance us from the emotion of the scene., What 'emotion'? Girl just got stabbed in the ear with an ice pick., She's scared! Fear is an emotion!  Look, kid, if you remember anything from your time working with Harry Zimm, let it be the three key words to filmmaking., ",get shorty,m70,1995,"['comedy', 'crime', 'thriller']",informal
8722,8722,L233436,"Yeah, but whose point of view?, Whatta you mean, whose point of view; The audience's point of view., Get down here. I wanna talk to you. Come on... right now...  She's gonna talk to Martin?, ",get shorty,m70,1995,"['comedy', 'crime', 'thriller']",informal
8727,8727,L233533,"Well, aren't you gonna offer me whatever it is you taste like?, Come on in., ",get shorty,m70,1995,"['comedy', 'crime', 'thriller']",informal
8757,8757,L235982,"Let's not be too hasty., Yeah. Hell, what difference does it make if we report it now or later? We call this in now, gonna be Coastguard, FBI, who knows who, all over the place., ",ghost ship,m71,2002,"['horror', 'mystery', 'thriller']",informal
8758,8758,L235920,"Where's his boat, then? Where's his crew? He ain't gonna be out here by himself, that's for damn sure., She's so big somebody could come alongside her on the other side and we'd never know it., ",ghost ship,m71,2002,"['horror', 'mystery', 'thriller']",informal
8759,8759,L235892,"Yeah, but not as cold as those Swedish girls you only gonna dream about., We'll see who's dreamin', m'man., ",ghost ship,m71,2002,"['horror', 'mystery', 'thriller']",informal
8765,8765,L235729,"You think the extra strain caused it?, Nah. Everything was cool. It's just one of those things., ",ghost ship,m71,2002,"['horror', 'mystery', 'thriller']",informal
8766,8766,L235712,"Hypothetically speaking, what if we get this boat to Sitka and find out somebody wants it back?, They shoulda thought of that when they let her float away., I don't care what, ain't nobody just gonna let us walk away with a ship that size., ",ghost ship,m71,2002,"['horror', 'mystery', 'thriller']",informal
8767,8767,L235574,"Looks like Epps' gonna get some tonight., With that coxswain dickhead., ",ghost ship,m71,2002,"['horror', 'mystery', 'thriller']",informal
8773,8773,L235938,"One guy isn't gonna be so stupid., Maybe he isn't alone., ",ghost ship,m71,2002,"['horror', 'mystery', 'thriller']",informal
8774,8774,L235932,"Fifty million dollars. Fifty million. We gonna let this guy just take it from us? One guy?, So we kill him?, I'm saying we gotta do whatever we gotta do to preserve our interest., ",ghost ship,m71,2002,"['horror', 'mystery', 'thriller']",informal
8777,8777,L235874,"What other choices have we got?, I tell you one thing, we're not gonna be towing no ship now., ",ghost ship,m71,2002,"['horror', 'mystery', 'thriller']",informal
8778,8778,L235869,"This's gonna hurt a little., Thanks for the warning -- Ow! Damn!, ",ghost ship,m71,2002,"['horror', 'mystery', 'thriller']",informal
8809,8809,L235894,"Dreamin's all any of you're gonna be doing if we don't get this boat running., Yeah, yeah., ",ghost ship,m71,2002,"['horror', 'mystery', 'thriller']",informal
8813,8813,L235838,"So what're we gonna do. That's the big question, right?, A salvage claim to a vessel's cargo's as valid as a claim to the vessel itself. It's ours., Then we're rich. We're damn, filthy stinking rich., It looks like it., ",ghost ship,m71,2002,"['horror', 'mystery', 'thriller']",informal
8818,8818,L235763,"What's this?, Turbine rotor's shot., I thought you said it was just a blade., Metal's crystallized. Gotta replace the whole deal., How much longer's that gonna take?, Like I always say --, I know I know, two ways to do anything --, The right way and the wrong way., But how long?, Hard to say., We gotta get outa here, Dodge. A storm blows up and we're history., I'm telling you, you don't want to be running that fan like it is., What about running number two by itself?, It's a full 2500 horses down. We couldn't drag that boat down hill on ice with it., How long, then?, I gotta pull the blades and re-seat everything in a new rotor -- ., How long?, Three, four days., Goddamit, Dodge., What do you want me to tell you, that we can throw this sucker back in and start pulling her like nothing happened? Can't do it, skipper., ",ghost ship,m71,2002,"['horror', 'mystery', 'thriller']",informal
8826,8826,L236262,"I can't believe you. Dodge's dead and all you can think about is cashing in your share., I didn't sign up to go home empty handed. And I sure ain't gonna roll over for the freaky motherfucker did this., ",ghost ship,m71,2002,"['horror', 'mystery', 'thriller']",informal
8828,8828,L236230,"I don't even want to know what that's gonna taste like now., Better than starving to death., ",ghost ship,m71,2002,"['horror', 'mystery', 'thriller']",informal
8838,8838,L236320,"You killed them., It was only a matter of time before somebody killed somebody.  You saw it coming as well as I did. Dodge had his plans, starting with scuttling the boat. And Greer too, except he went nuts. Couldn't take it, I guess. Could've happened in the middle of downtown Anchorage. But did it make him any less dangerous? I don't think so., So you killed them?, The way I figure it, it was them or me. I thought putting Dodge up on that pipe was a nice touch? Bought a little time. Made it look like whoever killed those Greeks was still around. But it's just us on this ship. Us and your... spirit friends., And now you're gonna kill me, is that it?, I didn't want it to turn out this way., Murphy, don't you see what's happening?, I think I see it pretty well., It's the ship. The ship's making you think this way., I know a little bit about human nature and what I've seen only confirms that., It's a trap. There was no way we were gonna get away with that gold. Nobody ever does. It's just the bait. This ship sucks people in and it never lets them out., I think maybe you been on this boat a little too long, with all that supernatural mumbo jumbo. There's nothing supernatural about greed. And that's what it comes down to, pure and simple., I don't give a damn about the gold., I wish I could believe that. Either way, you know what I've done. I've got no choice., ",ghost ship,m71,2002,"['horror', 'mystery', 'thriller']",informal
8874,8874,L236264,"Nobody's going anywhere with that gold now. Anybody tries to board, we'll know about it.  You can do what you want, Greer. But neither of us is gonna risk saving your ass down here if it comes to that., Fine with me., ",ghost ship,m71,2002,"['horror', 'mystery', 'thriller']",informal
8882,8882,L236119,"We're not gonna be able to pump it!, Alright. Everybody grab your gear! This' is where we get off!, ",ghost ship,m71,2002,"['horror', 'mystery', 'thriller']",informal
8890,8890,L235940,"I say we off-load some of that gold now., Would you hold on just a minute here, please? Look, there's no reason to panic now. Epps saw somebody. Fine. It's a big boat.  Chances're real good he doesn't even know about the gold. If we stay cool, nobody'll be the wiser.  The gold stays where it is til we're ready to go. Like I said, it'll be a hell of a lot safer there than here., ",ghost ship,m71,2002,"['horror', 'mystery', 'thriller']",informal
8891,8891,L235935,"I don't know., Let's just take it easy here, alright? Nobody's gonna kill anybody., Supposing he wants to get bad with us?, ",ghost ship,m71,2002,"['horror', 'mystery', 'thriller']",informal
8892,8892,L235879,"Fifty million four ways. That's twelve million and change a piece.  What you gonna do with your share, skipper?, Not much at all, I guess. Retire. Live out my golden years and all that., ",ghost ship,m71,2002,"['horror', 'mystery', 'thriller']",informal
8895,8895,L235846,"Yeah, but we still gotta haul that big piece of shit all the way back to Sitka., It's worth the effort. Believe me. Besides we're gonna need her to prove the salvage., ",ghost ship,m71,2002,"['horror', 'mystery', 'thriller']",informal
8896,8896,L235842,"So what? We gonna unload the gold and get a move on?, We leave it where it is. Stick to the plan., ",ghost ship,m71,2002,"['horror', 'mystery', 'thriller']",informal
8928,8928,L237204,"Hey, it's nearly nine already - we're gonna have to leave now if we're going to make that movie., Oh, all right... Party-pooper! Just let me put a few things away., ",ghost world,m72,2001,"['comedy', 'drama']",informal
9317,9317,L239185,"Beautiful, beautiful.  Work with me, baby. Just have fun with it.  Okay, he's playing it cool.  Let's finish up and get out of here., I'll get one more reading., ",ghostbusters ii,m74,1989,"['action', 'adventure', 'comedy', 'fantasy', 'sci-fi', 'action', 'adventure', 'comedy', 'sci-fi']",informal
9360,9360,L239671,"Oh, no, I feel great.  I just ordered some more vitamins.  I see you were exercising. So was I.  I taped ""20 Minute Workout"" and played it back at high speed so it only took ten minutes and I got a really good workout. You wanna have a mineral water with me?, No thanks, Louis.  I'm really tired.  I've been rehearsing all morning., Okay.  I'll take a raincheck.  I always have plenty of mineral water and other nutritious health foods, but you know that.  Listen, that reminds me, I'm having a party for all my clients.  It's gonna be my fourth anniversary as an accountant.  I know you fill out your own tax return, but I'd like you to come being that you're my next door neighbor and all ..., Oh, that's nice, Louis.  I'll stop by if I'm around., You know you shouldn't leave your TV on so loud when you go out.  That creep down the hall phoned the manager., I thought I turned it off.  I guess I forgot., ",ghostbusters,m75,1986,"['animation', 'comedy', 'fantasy', 'sci-fi', 'horror']",informal
9399,9399,L239990,"May I please see the storage facility?, Why do you want to see it?, Well, because I'm curious.  I want to know more about what you do here.  Frankly, there have been a lot of wild stories in the media and we want to assess any possible environmental impact from your operation. For instance, the storage of noxious, possibly hazardous waste materials in your basement.  Now either you show me what's down there or I come back with a court order., Go ahead!  Get a court order.  Then I'm gonna sue your ass off for wrongful prosecution., Have it your way, Mr. Venkman., Hey!  Make yourself useful!  Go save a tree!, ",ghostbusters,m75,1986,"['animation', 'comedy', 'fantasy', 'sci-fi', 'horror']",informal
9439,9439,L239820,"I'm getting high readings near the air vents.  It must be using the duct system to get around.  See, I told you we'd get something., So far all we got is a shit smell on the twelfth floor and we almost fried a Puerto Rican bellboy., All right.  Let's cool the negative vibes. These things can sense them., ",ghostbusters,m75,1986,"['animation', 'comedy', 'fantasy', 'sci-fi', 'horror']",informal
9911,9911,L255457,"One question. Do you want to stick to that story, or do you want to keep your teeth?, I want to keep my teeth., Now I'll ask you another. You think I got no contacts out here? That nag paid off at just the opening price. There wasn't hardly a flutter on the tote board from the time the odds were posted. There ain't enough action to tickle the tote, but you claim a ten grand win! You send me ten thousand dollars, like I'm some mark you can blow off!, Bobo, no, I --, You wanna talk to me straight up?, My son --, Your what?, My son was in the hospital --, What the fuck are you doin with a son?, He left home a long time ago. He was in the hospital, up in Los Ang gleez, real sick., Motherhood., I never fucked up before, Bobo., You expect me to buy this?, ",the grifters,m79,1990,"['crime', 'drama', 'thriller']",informal
9912,9912,L255453,"How'd you figure you were gonna get away with that?, I'm not getting away with anything, Bobo., You're fuckin right you're not. How much did your pals cut you in for on that nag, huh? Or did they give you the same kind of screwing you gave me?, I was down on that horse, Bobo. Not as much as I should have been, but there was a lot of action on those--, ",the grifters,m79,1990,"['crime', 'drama', 'thriller']",informal
9958,9958,L255978,"I need this, Roy. I can't run without money, and if I can't run I'm dead., You must have some money., Just a few bucks., And Myra's stuff?, Her credit cards. How far am I gonna get with that?, Far enough. Maybe up to San Francisco. Or St. Louis, someplace new. Start over., At what?, You're smart, Lilly, and you're good-looking. You won't have any trouble finding a job., A job? I've never had a legit job in my life!, Well, you're gonna start, if you hope to live through this. A square job and a quiet life. You start showing up at the track or the hot spots and Bobo's boys will be all over you., Roy, I know what to do with myself! It's a big world out there., Not any more. Lilly, listen, I'm giving you good advice. I'm following it myself., What?, I thought it over, and you were right. You wanted me out of the rackets, and now --, Roy, that's fine, but I don't have time for this. Bobo --, I thought you'd be happy for me. After all, you --, Bobo isn't after you! Bobo's after me, and he's goddamn good! But so am I. I'm a survivor, Roy. I survive., I know you do, so that's why --, And to survive, my way, I need money. Bobo knows about the stash in the car, so I didn't dare touch it, not if Lilly Dillon's dead. So that leaves this., No., ",the grifters,m79,1990,"['crime', 'drama', 'thriller']",informal
9975,9975,L255441,"Up to you., My boss is a guy named Bobo Justus, back in Baltimore. When a long shot gets too much action, I have to put money on that horse at the track, because it's the only way to get the odds down., Sure., The first day of the Delmar meet, there was a nag called Bluebell. I should have been on it. But that was the day after you came in here, so I stuck around to see how you were gonna be., ",the grifters,m79,1990,"['crime', 'drama', 'thriller']",informal
9983,9983,L255398,"Joe, I thought I was gonna be all right by now, I just need a little more --, It isn't the owner, Myra, it's my wife. She knows what's going on. This time, I gotta have the money., Joe, you know you'll --, ",the grifters,m79,1990,"['crime', 'drama', 'thriller']",informal
10050,10050,L257603,"Shit, John!  What the hell were you doing out there?!, Nothing., You're kidding with that answer, right?, I just went for a walk.  It's no big deal., Wrong.  There are rules in this house and you're going to follow them whether you like it or not., Or what?  You're gonna shoot me?, It's an option., Well, maybe if you'd let me live in the dorms, I wouldn't have to sneak out to spend time with my friends., Oh, so now it's my fault?, Just forget it..., ",halloween h20: 20 years later,m80,1998,"['drama', 'horror', 'thriller']",informal
10065,10065,L257791,"Not a real fan of Halloween humor, Will., Oh, right.  Sorry., I'm gonna head back to the office... finish up some things., Can't it wait till Monday?  I thought maybe we could dance...  I'm very light of my feet., ",halloween h20: 20 years later,m80,1998,"['drama', 'horror', 'thriller']",informal
10081,10081,L257506,"What's this?, You say, ""The key to my heart,"" and I'm gonna hurl., ",halloween h20: 20 years later,m80,1998,"['drama', 'horror', 'thriller']",informal
10085,10085,L261192,"Aren't you gonna answer that?, Answer what?, What if it's Kara?, ",halloween: the curse of michael myers,m81,1995,"['horror', 'thriller']",informal
10088,10088,L261163,"Jesus, that's my neighbor.  Tommy., Isn't he that psycho who's been spying on my sister?, Kara and Danny never showed up tonight. We'd better go home and check on them. There's nothing else for us to do here., But they're gonna light the tree in a few minutes --, We can light our own tree at home., ",halloween: the curse of michael myers,m81,1995,"['horror', 'thriller']",informal
10089,10089,L261082,"Seven-thirty is the costume pageant ... Carving jack-o'-lanterns at eight ... Photos for the school paper at nine ... Then Harry lights the tree at nine- thirty ... I just know I'm forgetting something!, Relax.  Everything's cool.  Didn't I tell you Harry would be here?, ",halloween: the curse of michael myers,m81,1995,"['horror', 'thriller']",informal
10090,10090,L260958,"Happy fuckin' Halloween., Someone's trying to scare us out of having this fair ... and it's not gonna work., ",halloween: the curse of michael myers,m81,1995,"['horror', 'thriller']",informal
10094,10094,L261101,"Come on, Mom.  We're gonna miss all the fun stuff!, Danny, you're just going to have to wait!, ",halloween: the curse of michael myers,m81,1995,"['horror', 'thriller']",informal
10099,10099,L261051,"He told me about the terrible things that happened here.  In our house., What the fuck are you doing letting strangers in without --, John, they sound Jamie Lloyd this morning! Someone tried to kill her!, What in God's name are you talking about, woman?  When are you gonna stop listening to those damned talk shows?, I'm getting the children out of here. At least until we know what we're dealing with.  John, I want you to come with us., Debra, you're fuckin' insane., You knew, didn't you, John?  You knew., ",halloween: the curse of michael myers,m81,1995,"['horror', 'thriller']",informal
